{
  "$schema": "../../schemas/api.schema.json",
  "element": "layout-cover",
  "type": "custom-element",
  "description": "Full-height (min-block-size) container that vertically centers a principal element, with optional top and bottom elements. Attribute form: data-layout=\"cover\".",
  "htmlvalidate": {
    "flow": true,
    "permittedContent": [
      "@flow"
    ]
  },
  "attributes": [
    {
      "name": "data-layout-min",
      "kind": "data",
      "purpose": "config",
      "type": "enum",
      "values": [
        "s",
        "m",
        "l",
        "xl",
        "auto"
      ],
      "default": "xl",
      "description": "Minimum block size: 50 / 70 / 80vh, xl = 100dvh, auto = none. One-off: style=\"--layout-min: 65vh\"."
    },
    {
      "name": "data-layout-padding",
      "kind": "data",
      "purpose": "config",
      "type": "enum",
      "values": [
        "none",
        "s",
        "m",
        "l",
        "xl"
      ],
      "default": "m",
      "description": "Padding on all sides."
    },
    {
      "name": "data-layout-gap",
      "kind": "data",
      "purpose": "config",
      "type": "enum",
      "values": [
        "none",
        "3xs",
        "2xs",
        "xs",
        "s",
        "m",
        "l",
        "xl",
        "2xl",
        "3xl"
      ],
      "default": "none",
      "description": "Gap between the non-centered elements, on the shared size scale."
    },
    {
      "name": "data-layout-centered",
      "kind": "data",
      "purpose": "config",
      "type": "boolean",
      "description": "Center children and text horizontally."
    }
  ],
  "childAttributes": [
    {
      "name": "data-layout-principal",
      "on": "any child",
      "description": "The vertically centered principal element. A sole child auto-centers without it.",
      "type": "boolean"
    },
    {
      "name": "data-layout-cover-top",
      "on": "any child",
      "description": "Pin to the top (a <header> child is pinned automatically).",
      "type": "boolean"
    },
    {
      "name": "data-layout-cover-bottom",
      "on": "any child",
      "description": "Pin to the bottom (a <footer> child is pinned automatically).",
      "type": "boolean"
    }
  ]
}
