{
  "$schema": "../../../schemas/api.schema.json",
  "element": "glossary-wc",
  "type": "web-component",
  "description": "Searchable, categorized, cross-linked glossary that progressively enhances a definition list",
  "htmlvalidate": { "flow": true, "permittedContent": ["dl", "@flow"] },
  "attributes": [
    { "name": "title",      "kind": "host-api", "purpose": "config", "type": "string",  "description": "Glossary heading" },
    { "name": "src",        "kind": "host-api", "purpose": "config", "type": "string",  "description": "URL to JSON term data" },
    { "name": "searchable", "kind": "host-api", "purpose": "config", "type": "boolean", "description": "Enables search input" },
    { "name": "compact",    "kind": "host-api", "purpose": "config", "type": "boolean", "description": "Reduced spacing variant" }
  ],
  "childAttributes": [
    { "name": "data-category", "on": "div", "type": "string", "description": "Category label for grouping terms" },
    { "name": "data-term-id",  "on": "div", "type": "string", "description": "Unique term identifier, used as fragment anchor" }
  ],
  "events": [
    { "name": "glossary-wc:ready",  "detail": "{ termCount, categories }",  "description": "After setup completes" },
    { "name": "glossary-wc:search", "detail": "{ query, matchCount }",      "description": "On search input" }
  ]
}
