{
  "$schema": "../../../schemas/api.schema.json",
  "element": "pop-over",
  "type": "web-component",
  "description": "General-purpose popover container with CSS Anchor Positioning. Wraps the native Popover API, binds an anchor element, and re-asserts display:none under VB's cascade layers. Trigger via standard popovertarget attribute.",
  "attributes": [
    {
      "name": "data-mode",
      "kind": "data",
      "purpose": "config",
      "type": "enum",
      "values": [
        "auto",
        "manual",
        "hint"
      ],
      "description": "Popover dismissal mode: 'auto' (default, light-dismiss + ESC), 'manual' (script-only), 'hint' (auto with hint-stack semantics)."
    },
    {
      "name": "data-anchor",
      "kind": "data",
      "purpose": "config",
      "type": "string",
      "description": "ID (or CSS selector) of the anchor element to position against. If omitted, the component finds the first element with popovertarget pointing at this pop-over."
    },
    {
      "name": "data-position",
      "kind": "data",
      "purpose": "visual-variant",
      "type": "enum",
      "values": [
        "top",
        "bottom",
        "left",
        "right",
        "top-start",
        "top-end",
        "bottom-start",
        "bottom-end",
        "left-start",
        "left-end",
        "right-start",
        "right-end"
      ],
      "description": "Where to place the popover relative to the anchor. Default: 'bottom'."
    },
    {
      "name": "data-offset",
      "kind": "data",
      "purpose": "visual-variant",
      "type": "enum",
      "values": [
        "none",
        "xs",
        "s",
        "m",
        "l"
      ],
      "description": "Gap between popover and anchor, mapped to --size-* tokens. Default: 'xs'."
    }
  ],
  "childAttributes": [],
  "structure": [],
  "htmlvalidate": {
    "flow": true,
    "permittedContent": [
      "@flow"
    ]
  }
}
