{
  "$schema": "../../../schemas/api.schema.json",
  "element": "emoji-picker",
  "type": "web-component",
  "description": "Accessible emoji picker with search, categories, and insertion",
  "attributes": [
    {
      "name": "for",
      "kind": "native",
      "purpose": "config",
      "type": "string",
      "description": "ID of target input/textarea/contenteditable for insertion"
    },
    {
      "name": "recent-limit",
      "kind": "host-api",
      "purpose": "config",
      "type": "number",
      "description": "Max recent emoji stored (default: 24)"
    },
    {
      "name": "data-trigger",
      "kind": "data",
      "purpose": "config"
    },
    {
      "name": "aria-haspopup",
      "kind": "aria",
      "purpose": "config"
    },
    {
      "name": "role",
      "kind": "native",
      "purpose": "config"
    },
    {
      "name": "data-group",
      "kind": "data",
      "purpose": "config"
    },
    {
      "name": "data-group-heading",
      "kind": "data",
      "purpose": "config"
    },
    {
      "name": "data-shortcode",
      "kind": "data",
      "purpose": "config"
    },
    {
      "name": "open",
      "kind": "native",
      "purpose": "config"
    }
  ],
  "events": [
    {
      "name": "emoji-picker:select"
    },
    {
      "name": "emoji-picker:open"
    },
    {
      "name": "emoji-picker:close"
    }
  ],
  "childAttributes": [],
  "structure": [],
  "htmlvalidate": {
    "flow": true,
    "permittedContent": [
      "@flow"
    ]
  }
}
