{
  "$schema": "../../../schemas/api.schema.json",
  "element": "token-specimen",
  "type": "web-component",
  "description": "Unified design token scale display. Renders shadows, radii, borders, colors, or sizes based on the type attribute.",
  "htmlvalidate": {
    "flow": true,
    "permittedContent": ["@flow"]
  },
  "attributes": [
    { "name": "type",        "kind": "host-api", "purpose": "config", "type": "enum", "values": ["shadow", "radius", "border", "color", "size"], "description": "Token type to display" },
    { "name": "tokens",      "kind": "host-api", "purpose": "config", "type": "string",  "description": "Comma-separated token names (defaults vary by type)" },
    { "name": "prefix",      "kind": "host-api", "purpose": "config", "type": "string",  "description": "CSS variable prefix (auto-set from type if omitted)" },
    { "name": "show-values", "kind": "host-api", "purpose": "config", "type": "boolean", "default": "true", "description": "Show computed token values" },
    { "name": "label",       "kind": "host-api", "purpose": "config", "type": "string",  "description": "Optional heading label" }
  ]
}
