[
  {
    "element": "brand-mark",
    "type": "custom-element",
    "htmlvalidate": {
      "flow": true,
      "permittedContent": [
        "@flow"
      ]
    },
    "attributes": [
      {
        "name": "data-size",
        "kind": "data",
        "purpose": "visual-variant",
        "type": "enum",
        "values": [
          "s",
          "l",
          "xl"
        ]
      },
      {
        "name": "data-stack",
        "kind": "data",
        "purpose": "visual-variant",
        "type": "boolean"
      }
    ]
  },
  {
    "element": "dl",
    "type": "native",
    "htmlvalidate": {
      "flow": true,
      "permittedContent": [
        "@script",
        "dt",
        "dd",
        "div",
        "dl-item"
      ]
    },
    "attributes": []
  },
  {
    "element": "dl-item",
    "type": "custom-element",
    "htmlvalidate": {
      "flow": true,
      "permittedContent": [
        "dt",
        "dd"
      ]
    },
    "attributes": []
  },
  {
    "element": "loading-spinner",
    "type": "custom-element",
    "htmlvalidate": {
      "flow": true,
      "phrasing": true,
      "permittedContent": [
        "@phrasing"
      ]
    },
    "attributes": [
      {
        "name": "data-size",
        "kind": "data",
        "purpose": "visual-variant",
        "type": "enum",
        "values": [
          "xs",
          "s",
          "m",
          "l",
          "xl"
        ]
      },
      {
        "name": "data-variant",
        "kind": "data",
        "purpose": "visual-variant",
        "type": "string"
      },
      {
        "name": "data-overlay",
        "kind": "data",
        "purpose": "config",
        "type": "boolean"
      }
    ]
  },
  {
    "element": "status-message",
    "type": "custom-element",
    "htmlvalidate": {
      "flow": true,
      "permittedContent": [
        "@flow"
      ]
    },
    "attributes": []
  },
  {
    "element": "text-divider",
    "type": "custom-element",
    "htmlvalidate": {
      "flow": true,
      "permittedContent": [
        "@phrasing"
      ]
    },
    "attributes": []
  },
  {
    "element": "user-avatar",
    "type": "custom-element",
    "htmlvalidate": {
      "flow": true,
      "permittedContent": [
        "@flow"
      ]
    },
    "attributes": []
  },
  {
    "element": "command-group",
    "type": "web-component",
    "htmlvalidate": {
      "flow": true,
      "permittedContent": [
        "@flow"
      ]
    },
    "attributes": [
      {
        "name": "label",
        "kind": "host-api",
        "purpose": "config",
        "type": "string"
      }
    ]
  },
  {
    "element": "command-item",
    "type": "web-component",
    "htmlvalidate": {
      "flow": true,
      "permittedContent": [
        "@phrasing"
      ]
    },
    "attributes": [
      {
        "name": "value",
        "kind": "host-api",
        "purpose": "config",
        "type": "string"
      },
      {
        "name": "data-shortcut",
        "kind": "data",
        "purpose": "config",
        "type": "string"
      }
    ]
  },
  {
    "element": "foot-note",
    "type": "web-component",
    "htmlvalidate": {
      "flow": true,
      "phrasing": true,
      "permittedContent": [
        "@phrasing"
      ]
    },
    "attributes": []
  },
  {
    "element": "browser-window",
    "type": "custom-element",
    "htmlvalidate": {
      "flow": true,
      "permittedContent": [
        "@flow"
      ]
    },
    "attributes": [
      {
        "name": "src",
        "kind": "host-api",
        "purpose": "config",
        "type": "string"
      },
      {
        "name": "url",
        "kind": "host-api",
        "purpose": "config",
        "type": "string"
      },
      {
        "name": "title",
        "kind": "native",
        "purpose": "config",
        "type": "string"
      },
      {
        "name": "shadow",
        "kind": "host-api",
        "purpose": "visual-variant",
        "type": "boolean"
      }
    ]
  },
  {
    "element": "code-block",
    "type": "custom-element",
    "htmlvalidate": {
      "flow": true,
      "permittedContent": [
        "@flow"
      ]
    },
    "attributes": [
      {
        "name": "language",
        "kind": "host-api",
        "purpose": "config",
        "type": "string"
      },
      {
        "name": "show-lines",
        "kind": "host-api",
        "purpose": "config",
        "type": "boolean"
      },
      {
        "name": "label",
        "kind": "host-api",
        "purpose": "config",
        "type": "string"
      }
    ]
  },
  {
    "element": "vb-composer",
    "type": "custom-element",
    "htmlvalidate": {
      "flow": true,
      "permittedContent": [
        "@flow"
      ]
    },
    "attributes": []
  },
  {
    "element": "vb-canvas",
    "type": "custom-element",
    "htmlvalidate": {
      "flow": true,
      "permittedContent": [
        "@flow"
      ]
    },
    "attributes": [
      {
        "name": "data-wireframe",
        "kind": "data",
        "purpose": "config",
        "type": "boolean"
      }
    ]
  },
  {
    "element": "vb-inspector",
    "type": "custom-element",
    "htmlvalidate": {
      "flow": true,
      "permittedContent": [
        "@flow"
      ]
    },
    "attributes": [
      {
        "name": "aria-label",
        "kind": "aria",
        "purpose": "semantic-state",
        "type": "string"
      }
    ]
  },
  {
    "element": "chat-thread",
    "type": "custom-element",
    "htmlvalidate": {
      "flow": true,
      "permittedContent": [
        "@flow"
      ]
    },
    "attributes": []
  },
  {
    "element": "chat-message",
    "type": "custom-element",
    "htmlvalidate": {
      "flow": true,
      "permittedContent": [
        "@flow"
      ]
    },
    "attributes": [
      {
        "name": "data-role",
        "kind": "data",
        "purpose": "config",
        "type": "enum",
        "values": [
          "user",
          "agent",
          "system"
        ]
      },
      {
        "name": "data-from",
        "kind": "data",
        "purpose": "config",
        "type": "string"
      },
      {
        "name": "data-from-label",
        "kind": "data",
        "purpose": "config",
        "type": "string"
      },
      {
        "name": "data-status",
        "kind": "data",
        "purpose": "semantic-state",
        "type": "string"
      },
      {
        "name": "data-model",
        "kind": "data",
        "purpose": "config",
        "type": "string"
      }
    ]
  },
  {
    "element": "chat-bubble",
    "type": "custom-element",
    "htmlvalidate": {
      "flow": true,
      "permittedContent": [
        "@flow"
      ]
    },
    "attributes": []
  },
  {
    "element": "calendar-event",
    "type": "custom-element",
    "htmlvalidate": {
      "flow": true,
      "permittedContent": [
        "@flow"
      ]
    },
    "attributes": [
      {
        "name": "data-category",
        "kind": "data",
        "purpose": "config",
        "type": "string"
      },
      {
        "name": "data-start",
        "kind": "data",
        "purpose": "config",
        "type": "string"
      },
      {
        "name": "data-duration",
        "kind": "data",
        "purpose": "config",
        "type": "string"
      }
    ]
  },
  {
    "element": "day-schedule",
    "type": "custom-element",
    "htmlvalidate": {
      "flow": true,
      "permittedContent": [
        "@flow"
      ]
    },
    "attributes": [
      {
        "name": "data-date",
        "kind": "data",
        "purpose": "config",
        "type": "string"
      }
    ]
  },
  {
    "element": "hour-view",
    "type": "custom-element",
    "htmlvalidate": {
      "flow": true,
      "permittedContent": [
        "@flow"
      ]
    },
    "attributes": [
      {
        "name": "data-overlap",
        "kind": "data",
        "purpose": "config",
        "type": "boolean"
      }
    ]
  }
]
