{
  "$schema": "../../../schemas/api.schema.json",
  "element": "site-index",
  "type": "web-component",
  "description": "Interactive site keyword index",
  "attributes": [
    {
      "name": "placeholder",
      "kind": "native",
      "purpose": "config",
      "type": "string",
      "description": "Search input placeholder (default \"Filter index…\")"
    },
    {
      "name": "letters",
      "kind": "host-api",
      "purpose": "config",
      "type": "string",
      "description": "Jump nav mode: \"entries\" (default) | \"all\" | \"none\""
    },
    {
      "name": "filter",
      "kind": "host-api",
      "purpose": "config",
      "type": "string",
      "description": "Search scope: \"topic\" (default) | \"all\""
    },
    {
      "name": "sort",
      "kind": "host-api",
      "purpose": "config",
      "type": "string",
      "description": "Sort mode: \"alpha\" (default) | \"count\""
    },
    {
      "name": "limit",
      "kind": "host-api",
      "purpose": "config",
      "type": "number",
      "description": "Max entries per letter before \"Show more\" toggle"
    },
    {
      "name": "src",
      "kind": "native",
      "purpose": "config",
      "type": "string",
      "description": "URL to load index data from (optional)"
    },
    {
      "name": "data-index-controls",
      "kind": "data",
      "purpose": "config"
    },
    {
      "name": "data-index-search",
      "kind": "data",
      "purpose": "config"
    },
    {
      "name": "href",
      "kind": "native",
      "purpose": "config"
    },
    {
      "name": "data-index-overflow",
      "kind": "data",
      "purpose": "config"
    },
    {
      "name": "data-index-expand",
      "kind": "data",
      "purpose": "config"
    }
  ],
  "childAttributes": [],
  "structure": []
}
