{
  "$schema": "../../schemas/api.schema.json",
  "element": "analytics-panel",
  "type": "web-component",
  "description": "Self-serve view of analytics data stored on the device — shows what's been captured this session, with Pause and Clear controls.",
  "htmlvalidate": {
    "flow": true,
    "permittedContent": ["@flow"]
  },
  "attributes": [
    { "name": "title",   "kind": "host-api", "purpose": "config",         "type": "string",  "description": "Override the panel heading (default: \"Analytics data\")" },
    { "name": "compact", "kind": "host-api", "purpose": "visual-variant", "type": "boolean", "description": "Tighter layout for embedding alongside other UI" }
  ],
  "structure": [],
  "childAttributes": [],
  "events": [
    { "name": "analytics-panel:cleared", "description": "Fired after session data is cleared by the user" },
    { "name": "analytics-panel:optout",  "description": "Fired when the user pauses analytics for this tab" },
    { "name": "analytics-panel:optin",   "description": "Fired when the user resumes analytics for this tab" }
  ]
}
