{
  "$schema": "../../../schemas/api.schema.json",
  "element": "qr-code",
  "type": "web-component",
  "description": "QR code generator web component",
  "attributes": [
    {
      "name": "value",
      "kind": "native",
      "purpose": "config",
      "type": "string",
      "description": "The text/URL to encode (or uses textContent). Reactive."
    },
    {
      "name": "size",
      "kind": "host-api",
      "purpose": "config",
      "type": "number",
      "description": "Canvas size in pixels (default: 200). Reactive."
    },
    {
      "name": "color",
      "kind": "host-api",
      "purpose": "config",
      "type": "string",
      "description": "Foreground color (default: currentColor). Init-only."
    },
    {
      "name": "background",
      "kind": "host-api",
      "purpose": "config",
      "type": "string",
      "description": "Background color (default: transparent). Init-only."
    },
    {
      "name": "error-correction",
      "kind": "host-api",
      "purpose": "config",
      "type": "number",
      "description": "Error correction level 0-3 (L/M/Q/H, default: 1/M). Init-only."
    },
    {
      "name": "role",
      "kind": "native",
      "purpose": "config"
    }
  ],
  "childAttributes": [],
  "structure": [],
  "htmlvalidate": {
    "flow": true,
    "permittedContent": [
      "@flow"
    ]
  }
}
