{
  "$schema": "../../../schemas/api.schema.json",
  "element": "accordion-wc",
  "type": "web-component",
  "description": "Accordion built on native details/summary with exclusive mode and transitions",
  "htmlvalidate": {
    "flow": true,
    "permittedContent": ["details"]
  },
  "attributes": [
    { "name": "single",     "kind": "host-api", "purpose": "config", "type": "boolean", "description": "Only allow one panel open at a time" },
    { "name": "bordered",   "kind": "host-api", "purpose": "visual-variant", "type": "boolean", "description": "Add borders between panels" },
    { "name": "flush",      "kind": "host-api", "purpose": "visual-variant", "type": "boolean", "description": "Remove outer border and padding" },
    { "name": "compact",    "kind": "host-api", "purpose": "visual-variant", "type": "boolean", "description": "Reduce spacing" },
    { "name": "indicator",  "kind": "host-api", "purpose": "config", "type": "enum", "values": ["plus-minus", "none", "custom"], "description": "Expand/collapse indicator style" },
    { "name": "transition", "kind": "host-api", "purpose": "config", "type": "enum", "values": ["fade", "slide", "scale"], "description": "Panel transition animation" }
  ],
  "structure": [
    { "element": "<details>",  "description": "One per accordion panel — native disclosure element" },
    { "element": "<summary>",  "description": "Panel heading inside each <details>" }
  ]
}
