{
  "$schema": "../../schemas/api.schema.json",
  "element": "layout-sidebar",
  "type": "custom-element",
  "description": "Two-column layout: a fixed-basis sidebar beside a flexible content column that wraps below it when there is no room. nav and aside children are the sidebar; every other child is content; without nav/aside the first child is the sidebar. Attribute form: data-layout=\"sidebar\".",
  "htmlvalidate": {
    "flow": true,
    "permittedContent": [
      "@flow"
    ]
  },
  "attributes": [
    {
      "name": "data-layout-gap",
      "kind": "data",
      "purpose": "config",
      "type": "enum",
      "values": [
        "none",
        "3xs",
        "2xs",
        "xs",
        "s",
        "m",
        "l",
        "xl",
        "2xl",
        "3xl"
      ],
      "default": "m",
      "description": "Gap between the columns, on the shared size scale."
    },
    {
      "name": "data-layout-side",
      "kind": "data",
      "purpose": "config",
      "type": "enum",
      "values": [
        "end"
      ],
      "description": "end: put the sidebar on the end side. nav/aside children keep DOM order (order: 1); the positional fallback reverses the row."
    },
    {
      "name": "data-layout-sidebar-width",
      "kind": "data",
      "purpose": "config",
      "type": "enum",
      "values": [
        "narrow",
        "normal",
        "wide"
      ],
      "default": "normal",
      "description": "Sidebar basis: 12 / 16 / 20rem (the same three values in every sidebar context)."
    },
    {
      "name": "data-layout-content-min",
      "kind": "data",
      "purpose": "config",
      "type": "enum",
      "values": [
        "s",
        "m",
        "l"
      ],
      "default": "m",
      "description": "Content column floor before wrapping: 40 / 50 / 60%. One-off: style=\"--layout-content-min: 45%\"."
    },
    {
      "name": "data-layout-nowrap",
      "kind": "data",
      "purpose": "config",
      "type": "boolean",
      "description": "Never wrap; the sidebar stays beside the content."
    }
  ],
  "childAttributes": [
    {
      "name": "data-layout-sticky",
      "on": "nav, aside",
      "description": "Sticky sidebar with its own scroll, active when the page opts into the smart sticky system (:root[data-sticky]).",
      "type": "boolean"
    }
  ]
}
