{
  "$schema": "../../schemas/api.schema.json",
  "element": "layout-stack",
  "type": "custom-element",
  "description": "Vertical flex stack with a consistent gap between children. Attribute form: any semantic element with data-layout=\"stack\".",
  "htmlvalidate": {
    "flow": true,
    "permittedContent": [
      "@flow"
    ]
  },
  "attributes": [
    {
      "name": "data-layout-gap",
      "kind": "data",
      "purpose": "config",
      "type": "enum",
      "values": [
        "none",
        "3xs",
        "2xs",
        "xs",
        "s",
        "m",
        "l",
        "xl",
        "2xl",
        "3xl"
      ],
      "default": "m",
      "description": "Gap between children, on the shared size scale."
    },
    {
      "name": "data-layout-align",
      "kind": "data",
      "purpose": "config",
      "type": "enum",
      "values": [
        "start",
        "center",
        "end",
        "stretch"
      ],
      "default": "stretch",
      "description": "Cross-axis (inline) alignment of children."
    }
  ]
}
