{
  "$schema": "../../../schemas/api.schema.json",
  "element": "change-set",
  "type": "web-component",
  "description": "Interactive change tracking group",
  "attributes": [
    {
      "name": "view",
      "kind": "host-api",
      "purpose": "config",
      "type": "string",
      "description": "'final' | 'original' | omitted (tracking)"
    },
    {
      "name": "datetime",
      "kind": "host-api",
      "purpose": "config",
      "type": "string",
      "description": "ISO date of the change set"
    },
    {
      "name": "author",
      "kind": "host-api",
      "purpose": "config",
      "type": "string",
      "description": "Author of the changes"
    },
    {
      "name": "data-controls",
      "kind": "data",
      "purpose": "config"
    },
    {
      "name": "aria-pressed",
      "kind": "aria",
      "purpose": "config"
    }
  ],
  "events": [
    {
      "name": "change-set:view"
    }
  ],
  "childAttributes": [],
  "structure": []
}
