{
  "$schema": "../../../schemas/api.schema.json",
  "element": "kanban-board",
  "type": "web-component",
  "description": "Columnar drag-and-drop board with user-defined columns, count badges, and optional WIP limits",
  "htmlvalidate": { "flow": true, "permittedContent": ["section"] },
  "attributes": [
    { "name": "src",     "kind": "host-api", "purpose": "config", "type": "string",  "description": "URL to JSON data for columns and items" },
    { "name": "title",   "kind": "host-api", "purpose": "config", "type": "string",  "description": "Optional heading above the board" },
    { "name": "compact", "kind": "host-api", "purpose": "config", "type": "boolean", "description": "Reduced spacing variant" }
  ],
  "childAttributes": [
    { "name": "data-column",       "on": "section", "type": "string",  "description": "Column identifier" },
    { "name": "data-column-label", "on": "section", "type": "string",  "description": "Display label for the column header" },
    { "name": "data-wip",          "on": "section", "type": "number",  "description": "Optional WIP limit — visual warning when exceeded" },
    { "name": "data-column-color", "on": "section", "type": "string",  "description": "Color token for column tint (success, warning, error, info)" }
  ],
  "events": [
    { "name": "kanban-board:transfer",     "detail": "{ itemId, fromColumn, toColumn, newIndex, item }",  "description": "Item moved between columns" },
    { "name": "kanban-board:reorder",      "detail": "{ itemId, column, oldIndex, newIndex }",            "description": "Item reordered within a column" },
    { "name": "kanban-board:ready",        "detail": "{ columnCount, itemCount }",                        "description": "Fired after component initializes" },
    { "name": "kanban-board:wip-exceeded", "detail": "{ column, limit, count }",                          "description": "Fired when a column exceeds its WIP limit" }
  ]
}
