{
  "$schema": "../../../schemas/api.schema.json",
  "element": "page-info",
  "type": "web-component",
  "description": "Document provenance disclosure panel",
  "attributes": [
    {
      "name": "auto",
      "kind": "host-api",
      "purpose": "config",
      "type": "boolean",
      "description": "Render from <meta> tags instead of light DOM"
    },
    {
      "name": "og-preview",
      "kind": "host-api",
      "purpose": "config",
      "type": "boolean",
      "description": "Show Open Graph social preview card"
    },
    {
      "name": "datetime",
      "kind": "host-api",
      "purpose": "config"
    },
    {
      "name": "data-trust",
      "kind": "data",
      "purpose": "config"
    }
  ],
  "events": [
    {
      "name": "page-info:verified"
    }
  ],
  "childAttributes": [],
  "structure": [],
  "htmlvalidate": {
    "flow": true,
    "permittedContent": [
      "@flow"
    ]
  }
}
