{
  "$schema": "../../../schemas/api.schema.json",
  "element": "site-map",
  "type": "web-component",
  "description": "Interactive HTML sitemap",
  "attributes": [
    {
      "name": "current",
      "kind": "host-api",
      "purpose": "config",
      "type": "string",
      "description": "Pathname of the current page"
    },
    {
      "name": "src",
      "kind": "native",
      "purpose": "config",
      "type": "string",
      "description": "URL to load sitemap data from (optional)"
    },
    {
      "name": "data-sitemap-controls",
      "kind": "data",
      "purpose": "config"
    }
  ],
  "childAttributes": [],
  "structure": []
}
