{
  "$schema": "../../../schemas/api.schema.json",
  "element": "glossary-index",
  "type": "web-component",
  "description": "Interactive glossary with search and scroll-spy",
  "attributes": [
    {
      "name": "placeholder",
      "kind": "native",
      "purpose": "config",
      "type": "string",
      "description": "Placeholder text for the search input"
    },
    {
      "name": "data-glossary-search",
      "kind": "data",
      "purpose": "config"
    },
    {
      "name": "href",
      "kind": "native",
      "purpose": "config"
    }
  ],
  "childAttributes": [],
  "structure": []
}
