{
  "$schema": "../../../schemas/api.schema.json",
  "element": "theme-export",
  "type": "web-component",
  "description": "Collects VB custom property overrides from a scope and emits them as a theme.css block (or JSON). The assembly glue for the Theme Composer.",
  "attributes": [
    { "name": "scope",    "kind": "host-api", "purpose": "config", "type": "string",  "default": ":root",  "description": "CSS selector for the scope to read overrides from." },
    { "name": "selector", "kind": "host-api", "purpose": "config", "type": "string",  "default": ":root",  "description": "Selector written in the emitted CSS output." },
    { "name": "include",  "kind": "host-api", "purpose": "config", "type": "string",  "description": "Comma-separated prefixes to collect. Default covers all VB token categories." },
    { "name": "format",   "kind": "host-api", "purpose": "config", "type": "enum", "values": ["css", "json"], "default": "css", "description": "Output format." },
    { "name": "label",    "kind": "host-api", "purpose": "config", "type": "string",  "description": "Optional heading label." },
    { "name": "live",     "kind": "host-api", "purpose": "config", "type": "boolean", "description": "Re-scan whenever an editable specimen fires a :change event." }
  ],
  "events": [
    { "name": "theme-export:change" }
  ]
}
