{
  "$schema": "../../../schemas/api.schema.json",
  "element": "chat-input",
  "type": "web-component",
  "description": "Form-associated chat input with auto-growing textarea",
  "htmlvalidate": {
    "flow": true,
    "permittedContent": [
      "@flow"
    ]
  },
  "attributes": [
    {
      "name": "name",
      "kind": "native",
      "purpose": "config",
      "type": "string",
      "description": "Form field name (default: \"message\")"
    },
    {
      "name": "maxlength",
      "kind": "host-api",
      "purpose": "config",
      "type": "number",
      "description": "Character limit (default: 4000)"
    },
    {
      "name": "minlength",
      "kind": "host-api",
      "purpose": "config",
      "type": "number",
      "description": "Minimum length to send (default: 1)"
    },
    {
      "name": "disabled",
      "kind": "native",
      "purpose": "config",
      "type": "boolean",
      "description": "Disables input and controls"
    },
    {
      "name": "autofocus",
      "kind": "native",
      "purpose": "config",
      "type": "boolean",
      "description": "Focus textarea on connect"
    }
  ],
  "events": [
    {
      "name": "chat-input:input"
    },
    {
      "name": "chat-input:send"
    }
  ],
  "childAttributes": [],
  "structure": []
}
